
jdds;référence;photo;titre;description;prix;option montage;tdm thérorique;stocks;lignes;encombrement
;p01;;Chaise turbis;La chaise turbis en plastique noir combine style et fonctionnalité. Son design moderne et ergonomique en fait le choix idéal pour ajouter une touche de sophistication à votre espace. Fabriquée avec des matériaux de haute qualité, elle offre un confort optimal pour vos moments de détente.;€50.00;false;;Grenis-p01,Bronis-p01,Albis-p01,Valis-p01;l005-01,l001-01,l003-01,l019-01,l031-01,l032-01,l059-01,l061-01,l067-01,l106-01,l173-01,l191-01,l203-01,l227-01,l234-01,l259-01,l260-01,l256-01,l243-01,l282-01,l296-01,l327-01,l358-01,l374-01,l380-01,l393-01,l305-01,l408-01,l044-01;moyen
jdd0;p02;;Chaise gingis;La chaise ningid en plastique orange apporte une touche de dynamisme à votre intérieur. Son allure vive et son design contemporain en font un élément de décoration à part entière. Conçue pour allier confort et esthétique, elle deviendra rapidement l'incontournable de votre espace de vie.;€50.00;false;;Grenis-p02,Valis-p02;l005-02,l001-02,l006-02,l011-02,l012-02,l015-02,l019-02,l030-02,l037-02,l062-02,l083-02,l092-02,l096-02,l095-02,l115-02,l136-02,l164-02,l165-02,l178-02,l196-02,l215-02,l223-02,l249-02,l292-02,l312-02,l329-02,l354-02,l375-02,l400-02,l404-02,l385-02,l305-02,l409-02,l203-02;moyen
jdd0;p03;;Chaise pogis;Élégante et polyvalente, la chaise pogis en plastique blanche incarne le mariage parfait entre style et praticité. Sa couleur neutre s'harmonise facilement avec tout type de décoration, tandis que sa construction robuste garantit une durabilité à toute épreuve. Ajoutez une touche de modernité à votre intérieur avec cette pièce incontournable.;€50.00;false;;;l019-03,l051-03,l063-03,l074-03,l087-03,l108-03,l158-03,l155-03,l178-03,l185-03,l208-03,l229-03,l262-03,l273-03,l290-03,l307-03,l330-03,l348-03,l390-03,l143-03;moyen
jdd0;p04;;Table tagis;La table tagis en plastique verte est un choix écologique et tendance pour votre espace extérieur. Son design minimaliste et sa couleur rafraîchissante apportent une touche de nature à votre jardin ou terrasse. Robuste et facile à entretenir, elle est parfaite pour vos repas en plein air ou vos moments de détente sous le soleil.;€120.00;true;10;Grenis-p04,Valis-p04,Albis-p04;l005-04,l001-04,l007-04,l016-04,l021-04,l031-04,l052-04,l058-04,l081-04,l054-04,l101-04,l169-04,l219-04,l111-04,l246-04,l267-04,l315-04,l331-04,l341-04,l390-04,l404-04,l325-04,l406-04,l143-04;moyen
jdd0;p05;;Canapé cainis;Transformez votre salon en espace de repos supplémentaire avec ce canapé-lit convertible. Le canapé cainis, son design moderne et son revêtement en tissu gris apportent confort et élégance à votre intérieur. Parfait pour accueillir les invités de dernière minute tout en optimisant l'espace.;€320.00;true;60;;l001-05,l032-05,l047-05,l048-05,l065-05,l074-05,l116-05,l128-05,l139-05,l266-05,l283-05,l317-05,l356-05,l357-05,l393-05,l372-05,l035-05,l305-05,l406-05,l203-05;fort
jdd0;p06;;Table bassis;Ajoutez une touche de sophistication à votre salon avec cette table basse en bois massif. Son plateau en verre transparent met en valeur la beauté naturelle du bois, tandis que son design apporte une note contemporaine à votre espace de vie.;€200.00;true;10;Bronis-p06,Albis-p06,Valis-p06;l004-06,l003-06,l009-06,l018-06,l023-06,l024-06,l030-06,l047-06,l064-06,l075-06,l090-06,l094-06,l124-06,l162-06,l166-06,l166-06,l190-06,l219-06,l111-06,l326-06,l313-06,l351-06,l353-06,l368-06,l397-06,l399-06,l389-06,l405-06,l403-06;fort
jdd0;p07;;Lit double chanis;Offrez-vous des nuits de sommeil réparateur dans ce lit double en chêne massif. Sa tête de lit rembourrée offre un confort supplémentaire pour vos moments de détente, tandis que sa construction robuste garantit une durabilité à long terme. Ajoutez une touche de luxe à votre chambre à coucher avec ce magnifique lit.;€600.00;true;90;Albis-p07,Valis-p07;l004-07,l002-07,l003-07,l006-07,l009-07,l012-07,l018-07,l022-07,l033-07,l039-07,l041-07,l088-07,l091-07,l114-07,l134-07,l137-07,l156-07,l166-07,l175-07,l180-07,l183-07,l187-07,l291-07,l293-07,l288-07,l323-07,l326-07,l311-07,l340-07,l391-07,l402-07,l305-07;fort
jdd0;p08;;Fauteuil rotis;Créez un coin de relaxation élégant dans votre jardin ou votre véranda avec ce fauteuil en rotin naturel. Son design organique et son coussin moelleux vous invitent à vous détendre en plein air tout en ajoutant une touche de charme rustique à votre espace extérieur.;€150.00;false;;;l005-08,l020-08,l042-08,l072-08,l081-08,l099-08,l119-08,l140-08,l163-08,l171-08,l190-08,l202-08,l208-08,l246-08,l252-08,l261-08,l264-08,l287-08,l304-08,l346-08,l366-08,l383-08,l197-08,l275-08,l143-08;moyen
jdd0;p09;;Lampadaire lapis;Illuminez votre salon avec style grâce à ce lampadaire en métal noir. Son abat-jour noir tamise la lumière pour créer une ambiance chaleureuse et accueillante, tandis que son design contemporain ajoute une touche d'élégance à votre décoration intérieure.;€230.00;true;5;Grenis-p09;l003-09,l023-09,l028-09,l067-09,l079-09,l098-09,l100-09,l109-09,l150-09,l180-09,l210-09,l211-09,l221-09,l222-09,l230-09,l231-09,l223-09,l239-09,l269-09,l285-09,l294-09,l345-09,l360-09,l364-09,l392-09,l408-09,l378-09,l385-09;faible
jdd0;p10;;Commode comis;Ajoutez une touche d'originalité à votre chambre ou à votre salon avec cette commode en bois dotée de tiroirs en rotin. Son design unique et ses matériaux naturels apportent une atmosphère chaleureuse et authentique à votre intérieur, tout en offrant un espace de rangement pratique pour vos vêtements ou vos objets décoratifs.;€170.00;true;20;;l026-10,l031-10,l049-10,l067-10,l070-10,l081-10,l085-10,l122-10,l147-10,l150-10,l168-10,l172-10,l178-10,l204-10,l205-10,l209-10,l232-10,l240-10,l251-10,l111-10,l268-10,l270-10,l300-10,l321-10,l333-10,l378-10,l384-10,l403-10,l408-10;moyen
jdd0;p11;;Etagère métalis;Ajoutez une touche de modernité à votre espace de vie avec cette étagère en métal au design contemporain. Ses lignes fines et sophistiquées apportent une esthétique chic et industrielle à votre intérieur. Cette étagère polyvalente offre un espace de rangement pratique pour vos livres, plantes et objets décoratifs. Solide et durable, elle constitue un choix parfait pour créer un espace organisé et élégant dans n'importe quelle pièce de votre maison.;€110.00;true;10;;l010-11,l025-11,l034-11,l076-11,l096-11,l117-11,l131-11,l132-11,l137-11,l177-11,l190-11,l195-11,l212-11,l209-11,l255-11,l251-11,l279-11,l299-11,l297-11,l319-11,l320-11,l352-11,l370-11,l377-11,l035-11,l305-11,l327-11,l379-11,l203-11;faible
jdd0;p12;;Meuble à chaussure chosis;Ajoutez une touche de modernité à votre entrée avec ce meuble à chaussures en acier brossé au design contemporain. Ses lignes épurées et son fini métallique apportent une esthétique élégante et sophistiquée à votre espace. Ce meuble compact est parfait pour ranger jusqu'à quatre paires de chaussures, offrant ainsi une solution pratique et organisée pour votre foyer. Solide et résistant, il constitue un choix idéal pour créer un espace accueillant et ordonné dès que vous franchissez la porte d'entrée.;€70.00;false;;;l008-12,l009-12,l010-12,l020-12,l045-12,l096-12,l089-12,l112-12,l129-12,l157-12,l181-12,l198-12,l200-12,l235-12,l224-12,l237-12,l258-12,l267-12,l269-12,l272-12,l289-12,l285-12,l324-12,l334-12,l349-12,l387-12,l389-12,l404-12,l370-12,l375-12,l305-12,l325-12,l379-12,l080-12,l105-12;faible
jdd0;p13;;Meuble sallis;Ajoutez une touche de fraîcheur à votre salle de bain avec ce meuble à monter blanc au design moderne. Ses lignes épurées et sa couleur blanche apportent une esthétique propre et lumineuse à votre espace. Ce meuble polyvalent est idéal pour ranger vos articles de toilette et autres nécessités de salle de bain, offrant ainsi une solution pratique et organisée pour votre routine matinale. Vous avez également la possibilité d'ajouter un miroir pour une fonctionnalité supplémentaire et pour agrandir visuellement votre salle de bain. Robuste et facile à monter, il constitue un choix parfait pour créer un espace de salle de bain élégant et fonctionnel.;€120.00;true;30;;l012-13,l049-13,l053-13,l056-13,l107-13,l133-13,l145-13,l148-13,l155-13,l174-13,l182-13,l192-13,l194-13,l197-13,l201-13,l199-13,l216-13,l217-13,l228-13,l238-13,l239-13,l245-13,l266-13,l308-13,l309-13,l310-13,l311-13,l316-13,l338-13,l350-13,l409-13,l393-13,l372-13,l375-13,l385-13,l132-13,l305-13,l080-13,l080-13;moyen
jdd0;p14;;Canapé vert canapis;Ajoutez une touche de luxe à votre salon avec ce canapé vert en velours au design élégant. Son revêtement en velours doux et sa couleur verte apportent une ambiance raffinée et chaleureuse à votre espace de vie. Conçu pour accueillir confortablement jusqu'à trois personnes, ce canapé est parfait pour les réunions en famille ou entre amis. Les gros coussins ajoutent non seulement du confort, mais également une esthétique moderne et accueillante à votre salon. Avec ce canapé, vous pouvez créer un espace de détente élégant et confortable où vous pourrez vous prélasser et vous détendre après une longue journée.;€240.00;true;45;;l006-14,l029-14,l027-14,l068-14,l081-14,l084-14,l102-14,l123-14,l142-14,l152-14,l161-14,l170-14,l169-14,l186-14,l193-14,l211-14,l226-14,l111-14,l268-14,l281-14,l286-14,l325-14,l372-14,l371-14,l379-14,l384-14,l408-14,l406-14,l393-14,l216-14,l352-14,l409-14;moyen
jdd0;p15;;Commode beguis;Ajoutez une touche de chaleur et de praticité à votre chambre avec cette commode marron facile à assembler dotée de six tiroirs. Son design classique et sa couleur marron apportent une ambiance chaleureuse et intemporelle à votre espace. Conçue pour être montée facilement, cette commode vous offre un rangement pratique et organisé pour vos vêtements, vos accessoires ou même vos articles de maison. Avec ses six tiroirs spacieux, vous disposez d'un espace généreux pour garder votre chambre en ordre. Que vous ayez besoin de ranger vos vêtements pliés ou vos objets personnels, cette commode polyvalente répondra à tous vos besoins tout en ajoutant une touche élégante à votre décor.;€110.00;true;30;;l008-15,l013-15,l024-15,l027-15,l031-15,l035-15,l050-15,l127-15,l124-15,l144-15,l146-15,l157-15,l167-15,l192-15,l199-15,l111-15,l274-15,l292-15,l298-15,l306-15,l317-15,l322-15,l335-15,l365-15,l369-15,l393-15,l375-15,l305-15,l410-15;moyen
jdd0;p16;;Commode compatis;Ajoutez une touche de modernité et d'élégance à votre chambre avec cette commode blanche et marron facile à assembler, dotée de six tiroirs. Son design contemporain et son contraste de couleurs apportent une esthétique raffinée et intemporelle à votre espace. Conçue pour être montée facilement, cette commode offre un rangement pratique et organisé pour vos vêtements, vos accessoires ou vos objets personnels. Avec ses six tiroirs spacieux, vous disposez d'un espace généreux pour garder votre chambre en ordre tout en ajoutant une touche de style à votre décor.;€150.00;true;30;;l019-16,l020-16,l040-16,l071-16,l082-16,l103-16,l125-16,l130-16,l157-16,l180-16,l188-16,l191-16,l201-16,l207-16,l214-16,l248-16,l254-16,l280-16,l349-16,l401-16,l405-16,l410-16,l305-16,l308-16,l325-16,l352-16,l379-16,l087-16;moyen
jdd0;p17;;Vase luminis;Ajoutez une touche de fraîcheur et d'élégance à votre décoration avec ce vase en verre transparent vert, haut de 40 cm. Sa couleur vive et sa transparence apportent une ambiance lumineuse et rafraîchissante à votre espace. Parfait pour être utilisé comme élément décoratif, ce vase ajoute une note de sophistication à n'importe quelle pièce de votre maison. Que vous y disposiez des fleurs fraîches ou des branches d'eucalyptus séchées, ce vase est un choix idéal pour mettre en valeur votre style personnel et embellir votre intérieur.;€20.00;false;;;l012-17,l019-17,l044-17,l051-17,l069-17,l097-17,l113-17,l138-17,l148-17,l151-17,l159-17,l179-17,l236-17,l253-17,l268-17,l271-17,l284-17,l302-17,l303-17,l313-17,l337-17,l373-17,l394-17,l396-17,l398-17,l388-17,l393-17,l407-17,l406-17,l401-17,l404-17,l132-17,l276-17,l305-17;faible
jdd0;p18;;Table basse feris;Apportez une élégance industrielle à votre salon avec cette table basse, caractérisée par son plateau en bois et sa structure en métal noir. Son design équilibré et ses matériaux contrastés offrent une esthétique moderne et sophistiquée à votre espace de vie. Parfaite pour supporter vos livres, magazines et boissons, cette table basse allie fonctionnalité et style avec brio. Que vous recherchiez un meuble central pour vos soirées détente ou un élément de décoration à part entière, cette table basse saura répondre à vos besoins tout en ajoutant une touche d'élégance à votre salon.;€50.00;true;10;;l027-18,l038-18,l049-18,l057-18,l066-18,l072-18,l099-18,l110-18,l128-18,l189-18,l224-18,l241-18,l314-18,l347-18,l355-18,l362-18,l381-18,l403-18,l404-18,l372-18,l385-18,l305-18;moyen
jdd0;p19;;Tables basses kikis;Apportez une touche contemporaine à votre salon avec cet ensemble de deux tables basses, arborant des plateaux en bois et des structures en métal. Pratique et esthétique, la petite table se range facilement sous la grande, offrant ainsi une solution astucieuse pour économiser de l'espace lorsque nécessaire. Le mariage du bois chaleureux et du métal noir confère à cet ensemble une esthétique moderne et sophistiquée, tandis que sa fonctionnalité permet de supporter divers objets de décoration ou de se transformer en espace de travail improvisé. Que ce soit pour les réunions entre amis ou les moments de détente en famille, ces tables basses polyvalentes ajouteront une touche d'élégance et de praticité à votre salon.;€100.00;false;;;l021-19,l023-19,l030-19,l043-19,l055-19,l075-19,l081-19,l083-19,l120-19,l135-19,l141-19,l129-19,l169-19,l233-19,l289-19,l294-19,l301-19,l319-19,l332-19,l344-19,l404-19,l407-19,l385-19,l325-19;moyen
jdd0;p20;;Fauteuil rose ikabis;Apportant une fusion subtile de modernité et de confort à votre espace, ce fauteuil en tissu rose est soutenu par une structure en métal, garantissant une stabilité et une durabilité optimales. Les coussins rose ajoutent une touche de douceur et de style à votre décor intérieur. De plus, les petits bouts en plastique situés sous la base du fauteuil assurent une protection supplémentaire contre les rayures sur vos sols, offrant ainsi une expérience complète alliant praticité et esthétique dans votre salon ou votre espace de détente.;€240.00;true;10;;l008-20,l017-20,l019-20,l022-20,l076-20,l078-20,l086-20,l104-20,l118-20,l184-20,l206-20,l213-20,l218-20,l220-20,l225-20,l242-20,l244-20,l268-20,l295-20,l318-20,l322-20,l359-20,l386-20,l377-20,l382-20,l277-20,l310-20,l410-20;moyen
jdd0;p21;;Fauteuil gris peritis;Apportant une touche contemporaine à votre espace, ce fauteuil en tissu gris est soutenu par une structure en métal, alliant style et solidité. Les coussins gris ajoutent une élégance discrète à votre décoration intérieure. De plus, les petits bouts en plastique situés sous la base du fauteuil assurent une protection efficace contre les rayures sur vos sols, offrant ainsi une expérience complète alliant confort et préservation de votre espace.;€245.00;true;10;;l019-21,l036-21,l040-21,l060-21,l073-21,l077-21,l081-21,l054-21,l093-21,l121-21,l153-21,l154-21,l160-21,l176-21,l247-21,l263-21,l265-21,l243-21,l245-21,l295-21,l339-21,l342-21,l350-21,l367-21,l376-21,l395-21,#r525,l375-21,l357-21,l379-21;moyen
jdd0;p22;;Table banis;La table banis en plastique et bois blanc est un choix écologique et tendance pour votre espace extérieur. Son design minimaliste et sa couleur blanche apportent une touche de raffinée à votre salon ou terrasse. Robuste et facile à entretenir, elle est parfaite pour vos repas en plein air ou vos moments de détente sous le soleil.;€45.00;true;5;;l014-22,l046-22,l050-22,l081-22,l126-22,l149-22,l156-22,l178-22,l210-22,l236-22,l250-22,l251-22,l257-22,l278-22,l288-22,l290-22,l296-22,l320-22,l328-22,l336-22,l343-22,l361-22,l363-22,l393-22,l375-22,l087-22;faible
